date,title,description,url,publisher,content
2025-01-30,12 High Growth Low PE Stocks to Buy - Insider Monkey,12 High Growth Low PE Stocks to Buy  Insider Monkey,https://news.google.com/rss/articles/CBMiiAFBVV95cUxNbmo1cmNQZ2RfUERTOFBOR2VLSmhiYmVpU0QyUlBtNm1KV0c2aTV5NVFTQTNyM2QzYWVld3Q0bGg2bi12YUY1STYzNmpIaVZKVXg2ekFsWDZLN2d0UDFxTkY3UnZzOUJ5S1VlT0RYTVdiNGdrVHFRRk5BZndRN05hMXNtcDhzajJk?oc=5&hl=en-US&gl=US&ceid=US:en,Insider Monkey,"Title: 12 High Growth Low PE Stocks to Buy - Insider Monkey

Summary: 12 High Growth Low PE Stocks to Buy  Insider Monkey

Key Details: Google News"
2025-02-04,Drone attack targets gas field in northern Iraq - Long War Journal,Drone attack targets gas field in northern Iraq  Long War Journal,https://news.google.com/rss/articles/CBMioAFBVV95cUxOanUybVZwWlhPNnZjeEtFeWotT1NFdlZyLU9hWl8tbWkzWXhleV83czBBRFdXWEVKTDFHUkZjc29EOGxZWUdSUXB1NGhWODQ3dUZUQmI1TmRiVmlFRXhmSVEwOXNJMHZrNnJvcHpNV1FBMklYWC1jMXlGX3JLTnhoZnh3Mlo5Y0VlM1NoVkQxY3ZESjVnRUpVZEhJR2pCUkJV?oc=5&hl=en-US&gl=US&ceid=US:en,Long War Journal,"Title: Drone attack targets gas field in northern Iraq - Long War Journal

Summary: Drone attack targets gas field in northern Iraq  Long War Journal

Key Details: Google News"
2025-02-14,"Raymond James cuts NOG stock target to $58, keeps strong buy - Investing.com","Raymond James cuts NOG stock target to $58, keeps strong buy  Investing.com",https://news.google.com/rss/articles/CBMiugFBVV95cUxOMW14UnU5cmkwOTdGbHhmZkVzWXhJMUxXQUtMZ09IRDdQNUY4ejdfa2l2Y000XzNuRjF5M0V2SHlfdnhyX1BETUtxdTdUZGJyenVoVUpRRDU5T3pDR3hiR2dVSDJvUmxLZEZMajFpYmYyNUhPTDV0b0FJMml0MzBRUTlQcnhzZnNuVExoX245bklfaDNkcXp5aTlWdkFhQ3V1OWZhdExoSDhZQUtmQmF3RnliSkxub3RodWc?oc=5&hl=en-US&gl=US&ceid=US:en,Investing.com,"Title: Raymond James cuts NOG stock target to $58, keeps strong buy - Investing.com

Summary: Raymond James cuts NOG stock target to $58, keeps strong buy  Investing.com

Key Details: Google News"
2025-02-21,Six New Dean Wildcats Come With 95% Oil in Northern Midland Basin - Hart Energy,Six New Dean Wildcats Come With 95% Oil in Northern Midland Basin  Hart Energy,https://news.google.com/rss/articles/CBMiowFBVV95cUxNdEtaRGxzdVU4WlUxd3h2WERwM0JvVHBucGVDOTd5WlNqTHFzUGVHRjRrWUdiVFk2c0JYWGFucHNqbzM1SEZHc3dZTEJSeU05WFNWR1FlUm9tWlQ2dDhJb2IzeXVsUG43Qno5YU5TNW5NVFFtRzVOcDN5dnRGdkhwbjR3UFd2VTdqZ0prMEVHNUtDN01OelBhRm5jMFRJa09vTzlr?oc=5&hl=en-US&gl=US&ceid=US:en,Hart Energy,"Title: Six New Dean Wildcats Come With 95% Oil in Northern Midland Basin - Hart Energy

Summary: Six New Dean Wildcats Come With 95% Oil in Northern Midland Basin  Hart Energy

Key Details: Google News"
2025-02-25,Analyst Expectations For Northern Oil & Gas's Future - Nasdaq,Analyst Expectations For Northern Oil & Gas's Future  Nasdaq,https://news.google.com/rss/articles/CBMigwFBVV95cUxPNXRlZlpVR0VpQUg1MzI5eXNhNXVSclZOZ1ljdnlOenR6UndURENEUTdyTXVNY2MweE1aMm1ENUhwWTc3eERBYllWVXEyOGVKa1IzWjdoY0dJX21WOXBoZlhfOXU5WC1aYnQtZUVtOFg3QUY2bTk0QkdjSkxHNjdneEI2cw?oc=5&hl=en-US&gl=US&ceid=US:en,Nasdaq,"Title: Analyst Expectations For Northern Oil & Gas's Future - Nasdaq

Summary: Analyst Expectations For Northern Oil & Gas's Future  Nasdaq

Key Details: Google News"
2025-03-03,NOG Stock Touches 52-Week Low at $31.11 Amid Market Challenges - Investing.com,NOG Stock Touches 52-Week Low at $31.11 Amid Market Challenges  Investing.com,https://news.google.com/rss/articles/CBMitwFBVV95cUxOdTRIb3FZMFVrVXNtU3dOWWVKdzhRRmpoYldOMGVMaHpoMEpocmtqWWJseTJYNU5IRHE4eEtqTDJ4TkpMZWpRa0U4NlVoMGQxY3dtU3cwWE9zcjU2MmpYU2FCTS11TDl4akNhTzRJZTAtNGZNMVo1cVV4U0RkZ05MWVdUaEVPX1IwbzhaR3BFckx1N0NId1REa1l0Vi0xa1NUNXBTYy1POTFnc3pzT3NlZTVYN2tpTWM?oc=5&hl=en-US&gl=US&ceid=US:en,Investing.com,"Title: NOG Stock Touches 52-Week Low at $31.11 Amid Market Challenges - Investing.com

Summary: NOG Stock Touches 52-Week Low at $31.11 Amid Market Challenges  Investing.com

Key Details: Google News"
2025-03-04,"Northern Oil and Gas, Inc. (NOG): Among the Dividend Stocks That Are Underperforming in 2025 - Insider Monkey","Northern Oil and Gas, Inc. (NOG): Among the Dividend Stocks That Are Underperforming in 2025  Insider Monkey",https://news.google.com/rss/articles/CBMiywFBVV95cUxQTFJVdUV6TUZsdnhfb3R1STFsUTBvQzAyUnQ1X1dZZ3RSMGxXTFVjWmNpdFNqVU5fZ081TmhacUwwb2ZNcEozMFRxdklWMFFFcVh4Q3NsUnpMNTVGbEo5Wi1uaE5mNUo1MUZ4N1NnSmRjQWRaU0k3aGdwRE9sUWg0SVppRlJCeDBYMmNqNTFOSVdJcmg5VDFRSDRyQmNIVFJYRHEzYTV4T2VTYy1WZzBtWnQ2a1lkbWZLU192QlZlRHprUDJjS3FpQXR0MNIB0wFBVV95cUxQYVN4ek12dWZ6enV2bllrZ01vUlVuVzM5TGI0TWE5OGZkRkI4alFjNTRJLTBCRWxMc3FEU0VqY1JPTWozTkFRR09LOTlVXzdtUElON0Q0bUluS0llNzA5WWt1bEtzblhucUpUSjBhUVFRV2FCUXBzT0FtQl9IWGs2NEs0MkIyQmluMElTT3RxTWVFWDN4eDFMZnlId25rREJuUnJfQzBWSnNrLWtMMzQyb05XMDlaYWw1QjB0a0RJRUhWd1lwa3ZlcE9nczMzQ2FfTG9v?oc=5&hl=en-US&gl=US&ceid=US:en,Insider Monkey,"Title: Northern Oil and Gas, Inc. (NOG): Among the Dividend Stocks That Are Underperforming in 2025 - Insider Monkey

Summary: Northern Oil and Gas, Inc. (NOG): Among the Dividend Stocks That Are Underperforming in 2025  Insider Monkey

Key Details: Google News"
2025-03-11,NOG Board Approves Increase In Share Buyback Authorization - MarketScreener,NOG Board Approves Increase In Share Buyback Authorization  MarketScreener,https://news.google.com/rss/articles/CBMi4wFBVV95cUxOTk9TOGRqMzEyUTJJeXNnUWZjOExhTDZ3UUtuRGktV29XLThTZldRRXZXQlBFM3pwWmpsMTV1UUdvT2lMQkVCQWtwYmR4dkZRLVU0YUJhMlBZUHBvMU00UGY4U09VVFNnM2JTYzZLdW1oNjYzUEVIRERUYmRpak1hbGV6TlNCYTYtYXRvem9PY3VRWUFnWmQtbHdrMUplcU5US0d2NGpvUGt0LUtQYm15U3k2MVJyeDZXTzVnSVFzUW16VEt5SUZSSy1JZlhxUWNCdWhQUGU3WE45UnJfNEVFVkExMA?oc=5&hl=en-US&gl=US&ceid=US:en,MarketScreener,"Title: NOG Board Approves Increase In Share Buyback Authorization - MarketScreener

Summary: NOG Board Approves Increase In Share Buyback Authorization  MarketScreener

Key Details: Google News"
2025-03-11,Northern Oil and Gas boosts share buyback program by $100 million - Investing.com,Northern Oil and Gas boosts share buyback program by $100 million  Investing.com,https://news.google.com/rss/articles/CBMivgFBVV95cUxOcVNIcXNFSGRJbGd1ZEZsVVllWTRrNUpjLVFLUDNNVGZLY0czSGgzMjgwaWYtTjhlQ3JLT0ltU1dDWnpLZzQ3eDg3UnZLa0Z4bUdKQUhmQXM1b05MaU5IY0ZSbWFLNW1uaVRtbi16eXROQXJISkdxT2FnYV82eEZENzlwWDJzbWd6ODRoSlRCbE1pY2RVeU1yUnVzVDJpT0t1dF9McXlFWDBGbXJVRkp5bjBlZFNYZVFRMXZqeDh3?oc=5&hl=en-US&gl=US&ceid=US:en,Investing.com,"Title: Northern Oil and Gas boosts share buyback program by $100 million - Investing.com

Summary: Northern Oil and Gas boosts share buyback program by $100 million  Investing.com

Key Details: Google News"
2025-03-11,CEO’s Bold Move: Northern Oil And Gas Stock Purchase - TipRanks,CEO’s Bold Move: Northern Oil And Gas Stock Purchase  TipRanks,https://news.google.com/rss/articles/CBMinAFBVV95cUxOSUROOFlDRHZraGFSWk1OaVFwWFV3djM4MXJDUFB4UmpJcWJoZ1RtYjRLNlRRZXkydG1aSWFHRzZ0dGRJSGVWbURlRUg5VHJ6aUpoa2ZmSVNLdEZBYzh6OEgtSlVMZE5mLURoYmptTGttUjRSNW8yUVRNSmNkelNyaTNEck5WZGpwSFVtOW10b3dtU0dra24xcWhkdDA?oc=5&hl=en-US&gl=US&ceid=US:en,TipRanks,"Title: CEO’s Bold Move: Northern Oil And Gas Stock Purchase - TipRanks

Summary: CEO’s Bold Move: Northern Oil And Gas Stock Purchase  TipRanks

Key Details: Google News"
2025-03-17,Insider Stock Buying Reaches US$1.74m On Northern Oil and Gas - Yahoo Finance,Insider Stock Buying Reaches US$1.74m On Northern Oil and Gas  Yahoo Finance,https://news.google.com/rss/articles/CBMigwFBVV95cUxPNEdvQTBCQlJxNkJIYk9MZ1dSUHNFWkswRG1qWmFRdFlwaS1WSjlnNTZNWV9jWVFOS05SYmtDY2VJV0w5MlZjWElBR3JpQTV1OGRIOEUzbG9kMTFIN0xObExnN1Y3YndKR2g2eWpfY1lKd01zakszYTAtUkRkbkZCMmNjWQ?oc=5&hl=en-US&gl=US&ceid=US:en,Yahoo Finance,"Title: Insider Stock Buying Reaches US$1.74m On Northern Oil and Gas - Yahoo Finance

Summary: Insider Stock Buying Reaches US$1.74m On Northern Oil and Gas  Yahoo Finance

Key Details: Google News"
2025-03-20,Crude oil production in Alaska is expected to jump - marketplace.org,Crude oil production in Alaska is expected to jump  marketplace.org,https://news.google.com/rss/articles/CBMimwFBVV95cUxOek9JN3p5TjZxcEZqZ1piRWhESWt4TkpEU3RSR3o2RXRpMVp0RU1nR3ZHeFIyclJNdWM3SklwbHdWOHNLOHlCcF9YUWNSZE9aNV9FS1FIN1FLaWQ1eXhJMDlmYUNaSXZ5M1RRZ2ZQSDlZNDR4Q0lqMXZvTHQ1OENYWDJDOUxteHdqMElXN3UzMGdNZldwaE5CX01lbw?oc=5&hl=en-US&gl=US&ceid=US:en,marketplace.org,"Title: Crude oil production in Alaska is expected to jump - marketplace.org

Summary: Crude oil production in Alaska is expected to jump  marketplace.org

Key Details: Google News"
2025-03-21,Northern Oil and Gas (NOG) Down 13% Since Last Earnings Report: Can It Rebound? - Yahoo Finance,Northern Oil and Gas (NOG) Down 13% Since Last Earnings Report: Can It Rebound?  Yahoo Finance,https://news.google.com/rss/articles/CBMie0FVX3lxTE5sY3RUZnVhaWdTY2pMbV9KRFprS0xwQWo4dXhMby12bTcyNWRxeHVaT0RBV0dpQkVYNWRPVzh3VDJxTV9SNV9Gb1dCeHVPMm5NT3pXQnhfUmZONlBtV0RnOHlMbk9JRS1FcDZrYVFhNGx1Ynp4M3BkeXlldw?oc=5&hl=en-US&gl=US&ceid=US:en,Yahoo Finance,"Title: Northern Oil and Gas (NOG) Down 13% Since Last Earnings Report: Can It Rebound? - Yahoo Finance

Summary: Northern Oil and Gas (NOG) Down 13% Since Last Earnings Report: Can It Rebound?  Yahoo Finance

Key Details: Google News"
2025-03-26,Northern Oil and Gas receives Ba3 CFR upgrade from Moody’s Ratings - Investing.com,Northern Oil and Gas receives Ba3 CFR upgrade from Moody’s Ratings  Investing.com,https://news.google.com/rss/articles/CBMixgFBVV95cUxQaU9jN0RVOXd5Mnl5MlgxV29UbnJpWlNrNlNWSUM0anRYaG9hdWxFaFN4aFpHT3pFTXRSTTZLSGtGclZ2dkh4aWcyOVg3dUpJSjNoNk56eS1MNy1Jci1NQmhqeXVETElSTzhQNm5BeXZxME95QnV3X1FvMXRSX295dTdWMnBXaTBKZHN3aFRueFhXSndtYmtrSFdndmFkNnJ0Z1N3b3c5bjk2QWY4Q1RBMEZZYlBhamZQUmsydjFIN3ZlcGhZdkE?oc=5&hl=en-US&gl=US&ceid=US:en,Investing.com,"Title: Northern Oil and Gas receives Ba3 CFR upgrade from Moody’s Ratings - Investing.com

Summary: Northern Oil and Gas receives Ba3 CFR upgrade from Moody’s Ratings  Investing.com

Key Details: Google News"
2025-04-01,SM Energy Marries Wildcatting and Analytics in the Oil Patch - Yahoo Finance,SM Energy Marries Wildcatting and Analytics in the Oil Patch  Yahoo Finance,https://news.google.com/rss/articles/CBMijgFBVV95cUxQYkpBZ1VodGYtb0xCVEdxWWg4V1RFT2hpb0c2OVllbVZ2a1JMSlpib0RobHlyWG1rSm5GdllDVEVXbDFtaThvRzhNNTNlTkVWcDA4akswOVpyWDVNX0VXbnFFbURENFMzQzBJeGRTbmxWVElLQnlFTDIxTm9qVWtfeU9mQmttVUdDUjRaOGZn?oc=5&hl=en-US&gl=US&ceid=US:en,Yahoo Finance,"Title: SM Energy Marries Wildcatting and Analytics in the Oil Patch - Yahoo Finance

Summary: SM Energy Marries Wildcatting and Analytics in the Oil Patch  Yahoo Finance

Key Details: Google News"
2025-04-07,"1 injured after incident at northern Colorado oil and gas facility, evacuations still in place - WesternSlopeNow.com","1 injured after incident at northern Colorado oil and gas facility, evacuations still in place  WesternSlopeNow.com",https://news.google.com/rss/articles/CBMiyAFBVV95cUxNSENnc3hZWnhrbm80djRhSmFMZ01teFZQMFBoeXNGNmp2al9nMlp1SVdyTnpZSFA2LTZTLVBxZ21aM3EyM21qV3NyalMxNUVINGMxa0RGajZlUVBtVERLMzJhWG9uUHdiNkJlX3AyVGc1aWR1SUhHNVZ1NnctdHpwVWtlaDJ1OVViNzJtRVJfZjRNWkNGZGpnZTVYeDNxRDJFQi1mcUhLMkI5M20ySFk3U3prYUpkS1p6ekU4UWNtWFhiSDd5dXo1QdIBzgFBVV95cUxOcmwtVlpWSDdBX2U5bWlkLWtNNW5feUQ0M3NnLVk3eGMzX25MX2lmVHV1UERic2E0NVJJTTZTQy1IZEdQQkx4UG1mMzRKd2IzbXBQbnNKMkVubGgyb2E2b0gzS2xOSUNIc1oybjhQQURvb2NnR0liMWhkMzBseWwteUpaUjliOXhWXzJXRGtfQ2hLM0xycXF2WFJranlPUm4ya3FWS3NySjdxTk8xZ0hsRjVIa3pUMS1GR1VkQVF4eXpLOHl2WS1HVzFYZDh1QQ?oc=5&hl=en-US&gl=US&ceid=US:en,WesternSlopeNow.com,"Title: 1 injured after incident at northern Colorado oil and gas facility, evacuations still in place - WesternSlopeNow.com

Summary: 1 injured after incident at northern Colorado oil and gas facility, evacuations still in place  WesternSlopeNow.com

Key Details: Google News"
2025-04-07,"Residents in Northern Colorado neighborhood asked to leave homes after ""oil and gas incident"" - CBS News","Residents in Northern Colorado neighborhood asked to leave homes after ""oil and gas incident""  CBS News",https://news.google.com/rss/articles/CBMiywFBVV95cUxQT2liZnVWRnFvN3BpOEs3TXhZQXB4bmhsM21pSjU3R0pQM3lTY1Y3WTJORUllbXROUVRGWWlPZnhaUUtOMl9ZRUduaThCT1FRb0Nsd2pmVGdQS3NQaUlyX2tObVNna2UtWnJYYkE4V1dTeUFQeXJ0QkZLa2c2a21VOE5KOVctdHEyaXFwTDcyR1pxLTBGTXoyZlJsR1NMM3VVUmJzYkI4T1lGaFU5aDVhUXFqY2pocWZoWnh3cVVWVGloV2dySTBPVU5nbw?oc=5&hl=en-US&gl=US&ceid=US:en,CBS News,"Title: Residents in Northern Colorado neighborhood asked to leave homes after ""oil and gas incident"" - CBS News

Summary: Residents in Northern Colorado neighborhood asked to leave homes after ""oil and gas incident""  CBS News

Key Details: Google News"
2025-04-10,"Officials say leak from oil and gas ""containment loss"" in Northern Colorado now contained - CBS News","Officials say leak from oil and gas ""containment loss"" in Northern Colorado now contained  CBS News",https://news.google.com/rss/articles/CBMiqgFBVV95cUxQdTBKcEV4VGFBRENVNUVBUVdKdVdkSEQ1NUZUbm9hMm5WWWpsYUUtbDY2ZkVUdkJmeGFKVEdUaTduc21EV1NKa0lJMXNLLUpDbnRzQ3Etdmt1NUxfU3RSSXlNcTBSWnZmV2Rla2VWNjZvTUkxNU5mODNkQVhjT1hyMl9QOTl0Z0MxMlVkVmR4MElrbUZ4S2JzaUtpdExOUzIydlRCTUltWDR2Z9IBrwFBVV95cUxOWmpDV3VadU1KcEFVS3E2VVFUcXFwNlpQOExZcjlkVDZ4SUJNWWxTNHFsZEVSMHhuelRiVUxVTC1DSldCeVc4bEtCOFE2OFpqRUFfRkEzQ0dOZS11WmtGbE1UVVpaVlBFVEQ4ZVpCclZkckZQWkNmLWc2Q0llaE1FNExrdnAwMkctcmtlNERuVGtQT1pmeEdYZGxuRjhiLUw4U1QwU1FlOWJkWE5wVUZz?oc=5&hl=en-US&gl=US&ceid=US:en,CBS News,"Title: Officials say leak from oil and gas ""containment loss"" in Northern Colorado now contained - CBS News

Summary: Officials say leak from oil and gas ""containment loss"" in Northern Colorado now contained  CBS News

Key Details: Google News"
2025-04-11,"Oil well release contained in Northern Colorado, evacuations remain in place - CBS News","Oil well release contained in Northern Colorado, evacuations remain in place  CBS News",https://news.google.com/rss/articles/CBMirAFBVV95cUxPR2JqUmZYZVkwTFU1eFVjaF95Wmpja3o2X3Fjcy1lb1ZPTjRhQ0Rna2x6eVJyb25nY3RzeXpZYmJPbTNUZkZveWdNVTJOaGp3VDVPNmlvMXkyMm5qbEJCYnhHMXdPZXpQNmplTlRsWE5JbGhnLTFmS2ZFcjBwOUhmVlAtUG1rZGlFMGZubjRGakJ1aUF2QmxfeW5qNm80RzJvTFNheEZqMV9SanFQ0gGyAUFVX3lxTE5YR1RfMTFPdkZPU0RSUFF0cjhhYVJtRGFFVFgtUzJCTUVSUzdNWDNZR09qVVc3blFXb0hDWl9EbThYM3JuYnZSZk1zUFg4Y3NwR0l2YWFFeS1pV3RFVzhqVUszcE5XSWFXTVZ1QjlkVFdiUkl3djlnRG1IUzZzcDZQVWsydUVmTFB2R3Y3ZWNHczZxS0VBNGNRdVdBV1M5ZDZVQzNUM1lrM3VUeVJuOWZYSWc?oc=5&hl=en-US&gl=US&ceid=US:en,CBS News,"Title: Oil well release contained in Northern Colorado, evacuations remain in place - CBS News

Summary: Oil well release contained in Northern Colorado, evacuations remain in place  CBS News

Key Details: Google News"
2025-04-14,Iraq signs Italy-Turkey deal for subsea oil pipeline - The Arab Weekly,Iraq signs Italy-Turkey deal for subsea oil pipeline  The Arab Weekly,https://news.google.com/rss/articles/CBMif0FVX3lxTFA1UVNLeVhScUlnelY5OEw0aklOWjBnczJ1UzVQZWdXcXVWbjMwUE5XNWk2QVo4akxEWGo4V3BadVVHelg3cVExWjRVS19nMlpyVEd3eHphMTdQN28tbXc5MnZEUVl1eTQxSDExTlN3dzhsckZ1aG02bEtDcXQ1WUk?oc=5&hl=en-US&gl=US&ceid=US:en,The Arab Weekly,"Title: Iraq signs Italy-Turkey deal for subsea oil pipeline - The Arab Weekly

Summary: Iraq signs Italy-Turkey deal for subsea oil pipeline  The Arab Weekly

Key Details: Google News"
2025-04-16,"Northern Oil And Gas Stock Climbs On Q1 Hedging Results, Shareholder Return Update: What You Need To Know - Benzinga","Northern Oil And Gas Stock Climbs On Q1 Hedging Results, Shareholder Return Update: What You Need To Know  Benzinga",https://news.google.com/rss/articles/CBMi7gFBVV95cUxQLXhSVmNIXzhKVjBqVVMyZGpwX0ZMLXNPRXR4V0hVQ2JFUjVUdWRIaXgzRDBSOEU4NjhrZ00xVWxGeHZZalVIUVlBX2JQZW82Ykh5Q2FhMWZlV3R0b1Y2YjAwNzktZENfSGdyRHZiSTVaeEItYmhDak1rWFJpSWlCb3IzYTR2SW9tVEZBSlFIaW5XWkR2YjRMUGxjbFY4SGF5Q29hWi1CT3JFVTlKX1oxTFhoVnoydFJ1WHdCQWlSczVuLVRXY2Q4T0c3Tnh0TmtqNV9wU0ZuZjFMZmtOellnNEpBTE9WdHBVQ25KQThn?oc=5&hl=en-US&gl=US&ceid=US:en,Benzinga,"Title: Northern Oil And Gas Stock Climbs On Q1 Hedging Results, Shareholder Return Update: What You Need To Know - Benzinga

Summary: Northern Oil And Gas Stock Climbs On Q1 Hedging Results, Shareholder Return Update: What You Need To Know  Benzinga

Key Details: Google News"
2025-04-18,"Northern Oil and Gas, Inc. (NOG): Among Mid-Cap Stocks Insiders Were Buying in Q1 2025 - Insider Monkey","Northern Oil and Gas, Inc. (NOG): Among Mid-Cap Stocks Insiders Were Buying in Q1 2025  Insider Monkey",https://news.google.com/rss/articles/CBMiwwFBVV95cUxQM1cyNEUwdm1rMk5YUnNJOG5MVUxBQV82dUNGWUx4UC1GMmRMOTUxZVpZNmNSNld6SFBOdXJldU9BSGxDR2RhdUpyaURhdThMUmZiUmttZDJ3Y09mb1dMWWVEWm1YRTBQT3NsUFVERmhtb2xUYjlVSnRZVTI2RnJ3U1gtaThDMExJOEdCQjQ2b3p6OXMzMXhjTHBpOF9JQkRIdmk2d0k1XzFZQVRVOXFweks1TlJfNUxLMXRiTGo2eGJVUU3SAcsBQVVfeXFMUDV1SjNuY0w4YTVvWE53SkZ3eWVZbmsyNEo1U2REZnpleWJrV2U0RHRDS25zWWpLQklONk5YY0RjWEhRd1ZJX0FBYlNtZExtOU9PQXlQQUpkX2pTRlh0ZlZhaUdzQ2t5eXdMWFlJSFZhU2xnY21rOTA0Z21oc1VKZ2k4ZkxfbjVSSUhkai1sSjhxZzRBVS0xOTNuRkxQMC1hMUJRZXdoakE4T2NoTDhEaHpiM3hPY1hsQjRnNVAtMVdSUkhvZGRSclZrRUk?oc=5&hl=en-US&gl=US&ceid=US:en,Insider Monkey,"Title: Northern Oil and Gas, Inc. (NOG): Among Mid-Cap Stocks Insiders Were Buying in Q1 2025 - Insider Monkey

Summary: Northern Oil and Gas, Inc. (NOG): Among Mid-Cap Stocks Insiders Were Buying in Q1 2025  Insider Monkey

Key Details: Google News"
2025-04-21,Should You Give Crescent Energy Stock the Cold Shoulder? - TradingView,Should You Give Crescent Energy Stock the Cold Shoulder?  TradingView,https://news.google.com/rss/articles/CBMisAFBVV95cUxPU0xLTlNGY0tIYjEyMTRWX3dCRmlSVnpKWEJkQjNrMlpRUXYzczdKM2V3c2EtSXFEOEVlNENsZVNGc2xGdUtOT0RoZE5HTE4tTTVtTlh4VHFzYTFBa29vcWxuUElkYkhpdkFReGVBeHJydnB4OU5QSzlrRUlnRkl1aUR0RHZNQ2M1SnQ2YmV1Q2lob0t3RW9NRVRPenUzYWVHcU9IYkJSZWlzM3RTWmhJNA?oc=5&hl=en-US&gl=US&ceid=US:en,TradingView,"Title: Should You Give Crescent Energy Stock the Cold Shoulder? - TradingView

Summary: Should You Give Crescent Energy Stock the Cold Shoulder?  TradingView

Key Details: Google News"
2025-04-29,Why Northern Oil And Gas Shares Are Dropping - TipRanks,Why Northern Oil And Gas Shares Are Dropping  TipRanks,https://news.google.com/rss/articles/CBMiiwFBVV95cUxPOG9ubV9veS0zQUNCckhlczhaZVU4RVhiVU83eTRMZlhGTXgzWWdTaE51Rlc3NXUxREJBbExncTZ4V0EzVlNDRzBDVy1YcktwcVA3MDFUX3VwWldJeFh0X3VJbmt3eWVDTzVNTkttdmJxUDF1MzlPSnQ5Z0JnYjcwblAwel9keW92bGpz?oc=5&hl=en-US&gl=US&ceid=US:en,TipRanks,"Title: Why Northern Oil And Gas Shares Are Dropping - TipRanks

Summary: Why Northern Oil And Gas Shares Are Dropping  TipRanks

Key Details: Google News"
2025-05-02,Northern Oil and Gas (NOG) Reports Q1 Earnings: What Key Metrics Have to Say - sharewise.com,Northern Oil and Gas (NOG) Reports Q1 Earnings: What Key Metrics Have to Say  sharewise.com,https://news.google.com/rss/articles/CBMi2AFBVV95cUxQVVZlcWRpRVRNbWgtNEdJREFwS3pxaWhQOVpGRzVHS250cWNBaTdrRl9qaGxaT2d3XzhSczZHMlJFV0tkV1ZIVllmZzBaYWN5alpoVjUzTmNaZklvRlVkSzI1UmlPYUdnMVNXRHU2dGpSQ1N4VW1fMFlCa1QyS3Exekt6bjh4TXVxWlpza3VKMVVPSFBLNTJLemRwTTB1VHNHaXVPZllrVWJRcFVoZldtbzh5RHhJbTVISzlFbURUaEU3aDBrVVNhZmppZnhhSTdIVnY5d05ZbnI?oc=5&hl=en-US&gl=US&ceid=US:en,sharewise.com,"Title: Northern Oil and Gas (NOG) Reports Q1 Earnings: What Key Metrics Have to Say - sharewise.com

Summary: Northern Oil and Gas (NOG) Reports Q1 Earnings: What Key Metrics Have to Say  sharewise.com

Key Details: Google News"
2025-05-13,Beyond The Numbers: 8 Analysts Discuss Northern Oil & Gas Stock - Nasdaq,Beyond The Numbers: 8 Analysts Discuss Northern Oil & Gas Stock  Nasdaq,https://news.google.com/rss/articles/CBMikgFBVV95cUxONGMyN2pTRm1ydmdnUmJfSzlCQ3Z1WTJjN0hpdXVmdzN2TVltdFJzVWhhQkdLcWZtYWRrUUhUSmhLd25GX0hfU1NlYXNncWZpN05WSU5YdE9QZ1ZVcURndGRETEhxVWFjY0V0eXU1aGg5aV9fc2dJN2p2bGNlRzJiYkJ6RGFvbGctQ0xnajFMNkU2UQ?oc=5&hl=en-US&gl=US&ceid=US:en,Nasdaq,"Title: Beyond The Numbers: 8 Analysts Discuss Northern Oil & Gas Stock - Nasdaq

Summary: Beyond The Numbers: 8 Analysts Discuss Northern Oil & Gas Stock  Nasdaq

Key Details: Google News"
2025-05-14,"Northern Oil and Gas, Inc. (NOG): One of the Underperforming Stocks Targeted By Short Sellers - Insider Monkey","Northern Oil and Gas, Inc. (NOG): One of the Underperforming Stocks Targeted By Short Sellers  Insider Monkey",https://news.google.com/rss/articles/CBMizAFBVV95cUxNM204cEloV0xYS1hXVTBTNGNmTnNFdjQ3NFFXdjFWcHcxR1pIZnZDaUNCY0lWaTg1bHI1TFljVmNOT1NCVGdHOExTcXU3RktXbWp6Y3dENFBhc05hczV5UXktd05BN0pJaWR4QlhWWmtBbTJ1WWpiOElCTGU3LUVOQkpjeVU2WnNicnZpWUktV0RlV3JrSGt6QW9ENy1KZjBKMXBQTlJ4RGxyU1dfRFdsYVoxLWJ0RkNqUmYwQ1dOUy1rd0J4Y0U0b1B4VEPSAdQBQVVfeXFMT01jWjd2a3QyY0pVTEFzY0VUNHE4R25KOEhuaWdnZjQ5bEdOY01JMXlPRFlkaE5WU3lXaWtjek0yVERuQzlpSkdBc3F0OVRpYU10UGF2Wk1wVGlHT2dkdkwxTUpjOUZzd2RqZS1rWlJpTUpEd3lob2xEaEdHV1ZtS3lXX1hRQVR5WjhtaFA3cXZxNDdubzFLT1Bub2ZrMkM5UTdjbnFCTlgzTG1XZVVsZWFzTkRuWDN1QVFSWGk4c3VDbUZxQWJ5SnhxTlZwMHZQaTVxSzk?oc=5&hl=en-US&gl=US&ceid=US:en,Insider Monkey,"Title: Northern Oil and Gas, Inc. (NOG): One of the Underperforming Stocks Targeted By Short Sellers - Insider Monkey

Summary: Northern Oil and Gas, Inc. (NOG): One of the Underperforming Stocks Targeted By Short Sellers  Insider Monkey

Key Details: Google News"
2025-05-27,Northern Oil & Gas announces annual meeting results - Investing.com,Northern Oil & Gas announces annual meeting results  Investing.com,https://news.google.com/rss/articles/CBMiqgFBVV95cUxNejlfV1NXMk83LU50dzIyeXN2TGNUUi1MWVlYdzh3WF9JaTJoc2owMXJBbVRlcWNqWUtOcTAyT3lNSzdqa3drdHVkVFVvaGlZN01NdHB0OWRfdDRpb01STUkxN1JvSDZ0ZEtsdVAtMTRXYmV1UXJSc0ZxLTZ6N010ZnhPaHI4MTh2REhvTUxZUVdEWGY2dl9pYW1faERyTW1YbDV5ZFFtcV9Kdw?oc=5&hl=en-US&gl=US&ceid=US:en,Investing.com,"Title: Northern Oil & Gas announces annual meeting results - Investing.com

Summary: Northern Oil & Gas announces annual meeting results  Investing.com

Key Details: Google News"
2025-05-29,Northern Oil and Gas (NOG) Up 12.4% Since Last Earnings Report: Can It Continue? - Nasdaq,Northern Oil and Gas (NOG) Up 12.4% Since Last Earnings Report: Can It Continue?  Nasdaq,https://news.google.com/rss/articles/CBMingFBVV95cUxQWVpfcUc2di1vbURUYWtMQmIwTlRnVTlRdGgwSUlJa1NoSUhnOERJN1lmRUxtQjFCaUhaV3Q1T2YyN2hTcF82TVVZNXhFWDA3Y2MxaVhoUGtMTUItY2ZxYXpxcEljSnlQbkxVSXZhZXY4QjN1Um5EdDMySmdYN3BrSEZWenNlMFo5QUhCQnI0Z1M2ZXlkc3NDXzRvQ0R6dw?oc=5&hl=en-US&gl=US&ceid=US:en,Nasdaq,"Title: Northern Oil and Gas (NOG) Up 12.4% Since Last Earnings Report: Can It Continue? - Nasdaq

Summary: Northern Oil and Gas (NOG) Up 12.4% Since Last Earnings Report: Can It Continue?  Nasdaq

Key Details: Google News"
2025-06-10,"Chevron announces cause of Northern Colorado oil and gas leak, says contractor failed to install equipment properly - CBS News","Chevron announces cause of Northern Colorado oil and gas leak, says contractor failed to install equipment properly  CBS News",https://news.google.com/rss/articles/CBMiqAFBVV95cUxQcTE2SjlzVXA0TlM2X3JlTnQxSXFMd3lzcnNyc3d6MWFGc2FHRFAyYlFOLWJqTGtaUVV0SWJYWFhLemJ4YktOQloxUzAyYWo5WEs2WERydzJUcjd6czVUakVrN3F4TnZWS29rZ01iZ2FONXc4dGJ1Z21aV041YjZTTUtkNFo3OVRZSl82UkNCUUNrdmp3UWdUaml5VlljdHNBcUZXb242YTI?oc=5&hl=en-US&gl=US&ceid=US:en,CBS News,"Title: Chevron announces cause of Northern Colorado oil and gas leak, says contractor failed to install equipment properly - CBS News

Summary: Chevron announces cause of Northern Colorado oil and gas leak, says contractor failed to install equipment properly  CBS News

Key Details: Google News"
2025-06-12,Northern Oil And Gas Announces $150M Notes Offering - TipRanks,Northern Oil And Gas Announces $150M Notes Offering  TipRanks,https://news.google.com/rss/articles/CBMipAFBVV95cUxQYjRqQUxFWGpIT25LRE1yNmZ3MGdWS3dYeEVxQ3hPaEFvbm1WM2VzUHBqWVh0eUhleXlMaE1WbkZPNUdNeWtkSzJ5S2Qtb3lsQktkX1VZRlh5ZV9WWWkzRWMtOTFGYmdVM3hpdF9fOVN6bHVRejZJTG83RDlLai1zZGJVQ255WGltZEZWMFA3d1pWdWF0cEp3ZkprY0hqYjJzNE9TSA?oc=5&hl=en-US&gl=US&ceid=US:en,TipRanks,"Title: Northern Oil And Gas Announces $150M Notes Offering - TipRanks

Summary: Northern Oil And Gas Announces $150M Notes Offering  TipRanks

Key Details: Google News"
2025-06-12,NOG Announces Proposed Reopening of 3.625% Convertible Senior Notes Due 2029 - Yahoo Finance,NOG Announces Proposed Reopening of 3.625% Convertible Senior Notes Due 2029  Yahoo Finance,https://news.google.com/rss/articles/CBMihwFBVV95cUxNdGFBeVdEQ3prUzBDWVBUYUhyRnNiMEhMS2JydjEwNTdST1FZdXBmbEttbmczc2Nid2FxbWZrMFpQbnV2U3NxdmRpdjFZdGtERHVNVHl0N0tfMVJqbVR0OEVZTTdhQ2JkZHBiNGllMFIwZTNWR0N3eGplSkdjcTJLYkFvTUtFTUE?oc=5&hl=en-US&gl=US&ceid=US:en,Yahoo Finance,"Title: NOG Announces Proposed Reopening of 3.625% Convertible Senior Notes Due 2029 - Yahoo Finance

Summary: NOG Announces Proposed Reopening of 3.625% Convertible Senior Notes Due 2029  Yahoo Finance

Key Details: Google News"
2025-06-12,Northern Oil And Gas Announces Convertible Notes Offering - TipRanks,Northern Oil And Gas Announces Convertible Notes Offering  TipRanks,https://news.google.com/rss/articles/CBMirgFBVV95cUxOSnZUaDluUkxTTGhWRnpWUkR0QWRYd2Via2FWQXFhZE56N2djUGlLN05ZR1NnOU5BVUM1QkR3TGg2aXRZNDNGeEtocV9CT04xZmVvR3lNOEZyeDFjdmVyNU9MYjdxSUxDd1d5b1psOXVnaUt4c1lscDgwMXVwMnZySFVNeVc2eFVVeXpHdW45eWg5YmUxZ2dwWVpPUWg1Z2pOOUlXOTVXajVOaVYzMmc?oc=5&hl=en-US&gl=US&ceid=US:en,TipRanks,"Title: Northern Oil And Gas Announces Convertible Notes Offering - TipRanks

Summary: Northern Oil And Gas Announces Convertible Notes Offering  TipRanks

Key Details: Google News"
2025-06-14,"If EPS Growth Is Important To You, Northern Oil and Gas (NYSE:NOG) Presents An Opportunity - Yahoo Finance","If EPS Growth Is Important To You, Northern Oil and Gas (NYSE:NOG) Presents An Opportunity  Yahoo Finance",https://news.google.com/rss/articles/CBMihgFBVV95cUxQcW1OVF9ra01uMjdaYXR4WE1aVjllaDAzaVZ0VWNOc3lqWDFNZ19SNjNmdFk1VE1oQTRFd3M2ZW1EWXg0c3lTazNqclQtQmJZM3JrZ3piVHM5TEFOUVhicmVHVXFUVExQYzZUU2VhWncxSVNrQU9zOUtBM2NoMU9PSVE4cE5tQQ?oc=5&hl=en-US&gl=US&ceid=US:en,Yahoo Finance,"Title: If EPS Growth Is Important To You, Northern Oil and Gas (NYSE:NOG) Presents An Opportunity - Yahoo Finance

Summary: If EPS Growth Is Important To You, Northern Oil and Gas (NYSE:NOG) Presents An Opportunity  Yahoo Finance

Key Details: Google News"
