date,title,description,url,publisher
2024-11-04,Berkshire Hathaway is dumping Apple stock and building its cash stockpile to record highs because Warren Buffett believes the government will raise capital gains taxes soon - Fortune,Berkshire Hathaway is dumping Apple stock and building its cash stockpile to record highs because Warren Buffett believes the government will raise capital gains taxes soon  Fortune,https://news.google.com/rss/articles/CBMipwFBVV95cUxPdU5HZkZzMGxuSlQybVFvZjFFU3lZczhLUDJaN2dWeFNHbExNVGo3M2ZvSGxXcmVIUjBRb2pnRnRmb04wYTRrV21FOGloWk5XYzBCZzlzM1MzZ0NZRXZ0azJJVUowWVpxWXZVRzNxcDhHUmFScGRqWkJRMzgydjk3ak9MUUdWQkRONXpKcGlKLUQydHloUWlSdHVUNm5HZm53X0NfMElmYw?oc=5&hl=en-US&gl=US&ceid=US:en,Fortune
2024-11-08,Cabinet advances proposal for northern oil export restart - Iraq Oil Report,Cabinet advances proposal for northern oil export restart  Iraq Oil Report,https://news.google.com/rss/articles/CBMioAFBVV95cUxQeVRZdlFIRUUtWm1Gd1hiMFNLekpZa3VQYTRsM1p0dE1NY09ZVWRTT3VBelVFdmlKWVY1bTFaSWZxcmVCU0lOWTY3NjJrMWhRSVJuMThOLUFhejllMG0wRGk3RVptNGtEaEpmdGN2SVBQR01EVDJaZkxnOWUxVFNkdk5VNndHejZLdHhfbjd6R1BJN3dKdWNoemg5SlBvZkJ1?oc=5&hl=en-US&gl=US&ceid=US:en,Iraq Oil Report
2024-11-13,"Ridgemar's owner explores $1 billion-plus sale of US oil producer, sources say - Reuters","Ridgemar's owner explores $1 billion-plus sale of US oil producer, sources say  Reuters",https://news.google.com/rss/articles/CBMivwFBVV95cUxNUjRjXzZEd1B4clB5UmxGanNEendTYzNPS28tYnBORjU0S2hZa3BOaEdURmliTjRPeGR4dWhfdFgyalpQOXNWaGpQYktyelhUOHFpNWU2d2lxNm1zdy1wamZYa1pWR1lmODkwZjAyaG5ic2dFYnJ0MnB1YVQ5M0xLYmNQY0JFWV9SZ1p1RHNjTkRhemRfb3prWkhCUFZBV2k1WFo5WTBEUzF5bWNWTjN5MjhPSnZxdm8zS3pudGtXTQ?oc=5&hl=en-US&gl=US&ceid=US:en,Reuters
2024-12-13,Northern Oil and Gas Investing $160M in Marcellus/Utica in 2025 - marcellusdrilling.com,Northern Oil and Gas Investing $160M in Marcellus/Utica in 2025  marcellusdrilling.com,https://news.google.com/rss/articles/CBMiowFBVV95cUxPZk4ySHNuZ1VSZEtObVh3Tmh2bExROU9JUnFXaW5FQlQwbDZ4eVJZM05lVzBJdXBIbjRIcjBaSG5pLTRTLU1ZdmhMVUxoSDBYcUY4Z3dmYVhyRWJOSWZTTFpvWDNTQmtRN1JTZlRZN1lSbW9GZHYybWVhNEF0N3ZLamxrRXZmd1VHbDh6TUg5YldWTHk0WDl0WUVwVUdFd2FHUzhn?oc=5&hl=en-US&gl=US&ceid=US:en,marcellusdrilling.com
2024-12-20,"Exclusive: Northern Oil and Gas in bid to acquire smaller rival Granite Ridge, sources say - Reuters","Exclusive: Northern Oil and Gas in bid to acquire smaller rival Granite Ridge, sources say  Reuters",https://news.google.com/rss/articles/CBMiugFBVV95cUxQQVZFSHl0aFJSVmZxbmdiTzF5WFBzcUgzOUhSLUtnLVMtdUdPSGcyc1k0MUN1eHdKU0x2SnFjMFlSdTllT3ZvNUZyYXlEOTI2a3ZhMzJyRFhUUnlvQ2ZsaHVJNzF3V2J5UkhtOEpFYVFFVDVDZVhTd1ZMY1FtODNyQU5qNm5KMktiVmtWaktkU2RaNEhMV2lMeXpwX0pUY0pxak9qeUNnU29CNUV1LXJOSmFHcmxBdHpLQ1E?oc=5&hl=en-US&gl=US&ceid=US:en,Reuters
2024-12-20,NOG Responds to Reuters Article in Regard to Potential Business Combination - Business Wire,NOG Responds to Reuters Article in Regard to Potential Business Combination  Business Wire,https://news.google.com/rss/articles/CBMizAFBVV95cUxNcDdLOWlkcXFQQk00N3FyNFJQTFBqMUJLQi05U3R0LVlNQXFfbmNBbFI0SmVzbFp1U25NRURUMWw5NEkxbVg2VEIwaGhVSlRNOTZJVFlhcGtRWWE4ZzUtN0Y4OXQySm56UVEyOUlEQmM4SUJSZTE4bk0yVUVGZ09SaXZuTFp1bmZlX2FHT3ltOXhMNVE4ak1rNjBveG1tSmJONFhpNFdfYmhhVjhaWkZwdEFsVzNLRHdYU3pEQnJRZXpnLVduSlVYX1FMVVQ?oc=5&hl=en-US&gl=US&ceid=US:en,Business Wire
2024-12-23,Northern Oil and Gas pursues acquisition of Granite Ridge Resources - Yahoo Finance,Northern Oil and Gas pursues acquisition of Granite Ridge Resources  Yahoo Finance,https://news.google.com/rss/articles/CBMiigFBVV95cUxPdmZhUGlNaDVsd3A2TVNEYWtkWlphcW8wMUNBOXdaaTFuWENMNzZjVU9PLXdDQlZmS3VzV3lIRnVOMmRWTnVzZk5aV0VfYnZrWXJPVzFHWDRkeFROMXNwYlEyTnl4ajg3ZU9SWDNRSFViVlYtcC1xdzZtb3pDcjJ1aTc0TzNMdmhpVmc?oc=5&hl=en-US&gl=US&ceid=US:en,Yahoo Finance
2024-12-23,NOG: Company Not in ‘Formal Negotiations’ to Buy Granite Ridge - Hart Energy,NOG: Company Not in ‘Formal Negotiations’ to Buy Granite Ridge  Hart Energy,https://news.google.com/rss/articles/CBMinwFBVV95cUxPZVYyUjk3NGNNd0p2ZHQxZkVOX01nS056cFlOXzhZQlk2Y1FudFBYQ0FoMXhqV1M2M0VWSlllRG0xYWZPYXNlXzZoZjhKM0UzRU1mSTBMNnZQQ3I3NUg0U1MzREpXdHlJN3k5SzRvTzlWSlo4S3F4TGx0eDVscldaM3lHRWZJRkpwVVhObXVCSDV0RlN0R213MDZUY2NyWms?oc=5&hl=en-US&gl=US&ceid=US:en,Hart Energy
2024-12-23,Eden Prairie’s Northern Oil and Gas takes unusual step to deny rumors of high-priced acquisition - Star Tribune,Eden Prairie’s Northern Oil and Gas takes unusual step to deny rumors of high-priced acquisition  Star Tribune,https://news.google.com/rss/articles/CBMimAFBVV95cUxNVGVkRXNrYk0wUF9WUmQyUVFyenVCeGljemNQSWhvUnZnOXhIYkJrajZHeXNiUm9Rc1U1Tmllcjl2SEZYQzhaYUlFMFduSmZ2OERzSEN0X3gxVjQzWFZ2cm8xcVppRF94Mmw0T2Fxb0lYNXlPRXZKMkZrYVZPdXpidjJfNWR5eUM3RnNRQmFQY19BRjdaOWZKWg?oc=5&hl=en-US&gl=US&ceid=US:en,Star Tribune
2024-12-23,Northern Oil and Gas makes acquisition offer to Granite Ridge - Offshore Technology,Northern Oil and Gas makes acquisition offer to Granite Ridge  Offshore Technology,https://news.google.com/rss/articles/CBMihwFBVV95cUxPMl9yZjE2Q21SS3ZPZW04VXcxelQwMzdHQldyWlJNN2xGdmN0WjJtVm5OcWo4TWJjM250c0ZKenJXMFRlSnFLU2lEdW5sYkFmaVk1X211R0NQNjNLejhxNGxEV2xHSTFuY0FYX3E3MVU3dEpkS2d3X2k1MnlUbFF0VlVCQlFQemM?oc=5&hl=en-US&gl=US&ceid=US:en,Offshore Technology
2025-01-07,Biden extends oil and gas leasing ban in Alaska’s Northern Bering Sea - Alaska Beacon,Biden extends oil and gas leasing ban in Alaska’s Northern Bering Sea  Alaska Beacon,https://news.google.com/rss/articles/CBMiqAFBVV95cUxQN0dyUzdJOWo2OXhFV0V3cDYxQ1F3dmgxOXlCVk4wcm1HYUZpRi1DYmRJWFEyRENSU2VwSXFwbkxkTW1waEUwT2JHRGtRZnlNekFmSWxNWUhMZmlYbEpRWlhGU0gzUmhPTlpJMVZPbmFKZm1NV3pwcWJZamFTU21yTDY1bTlGMTNVeGNZX2M1N29jOS0tNlI0b05sLUgzU2hxRnBEMTBoSHY?oc=5&hl=en-US&gl=US&ceid=US:en,Alaska Beacon
2025-01-21,NOG Schedules Fourth Quarter and Year-End 2024 Earnings Release and Conference Call - Business Wire,NOG Schedules Fourth Quarter and Year-End 2024 Earnings Release and Conference Call  Business Wire,https://news.google.com/rss/articles/CBMi1wFBVV95cUxNZWh4ZE5CY0ZwT3VhLUQtaEVOeU5RVWh2V2ZUZEd4QVlGd3FJMVBVYVVEUlkzYTBmS0RTbmhvbWlUQ3pOTzM4OUtfN2t5RlZOV1VFQl9jQ0M4YkdaRnpETnk5VmVvMmNlcFBEbXJ3ZnkzUEx1Vmsxa3gtc19jNGhZVmJNVVhtUWVMbFpTb1dGLWNsSlJnaEpNQUpOLXllTkVIT292R0hYMi11TmxmQTAwdDRGbVN0aGE2aHZXMXBVckVZT1JmRUotM1IyRGFvdlhiZm84TzUzdw?oc=5&hl=en-US&gl=US&ceid=US:en,Business Wire
2025-01-21,"Citi lifts Northern Oil and Gas stock target, Buy rating on revised estimates - MSN","Citi lifts Northern Oil and Gas stock target, Buy rating on revised estimates  MSN",https://news.google.com/rss/articles/CBMi6gFBVV95cUxNcDV1dkZtemRDNVN4ZGJ5blg4NjdJLTQzTzhfRDVqQm4yTmtNRDg1eFMxV2EzQXlKVE5TUHZxaWxwZ0puaEpVSkVyWk9zVDF6bVd0SU15Nnh2RWdFN2NzNXVQLXJObFVIN0hHamcxeldRSjRYMkZfcG5BMWdGenYxWGNCdktNTkUzQ0xPOWJGTzZsUXpEN3hadXE0MXJra3JRWlNYNTB2bHdDU0ZOZVEwSW1BSUU0U2Nyd2FPQlBaelhFVHZuZ2JVc05mNGF0ZGFZNFNtX0VjNVU2ZlloUTBTVG5HdWJxMEttTnc?oc=5&hl=en-US&gl=US&ceid=US:en,MSN
2025-01-24,Rising budget controversy endangers northern export restart - Iraq Oil Report,Rising budget controversy endangers northern export restart  Iraq Oil Report,https://news.google.com/rss/articles/CBMiowFBVV95cUxNMEFQMlFTUE8zandaczUwVzdzNmNYYlRQMmZDeVFxZ21ITjladWJuVEdkR0E3UWhLZGVJcV8wRlBwc1h5bUtNYzJWVk02WGdiVUtyWnBXUXhMMEtTVFBZeGhSMUtVcWtGUWpSQVk5VmtZMXJ4UjBkSGVYQjZCZDVsQ3hMRnU3UFVWN2VreXJ4eDVWWXBzVFlWZGZnTnZMQWRycmgw?oc=5&hl=en-US&gl=US&ceid=US:en,Iraq Oil Report
2025-01-28,"NOG Declares $0.45 Quarterly Cash Dividend, 12.5% Increase Year over Year; Provides Update on Share Repurchases - Business Wire","NOG Declares $0.45 Quarterly Cash Dividend, 12.5% Increase Year over Year; Provides Update on Share Repurchases  Business Wire",https://news.google.com/rss/articles/CBMi-wFBVV95cUxPaU5TNVZhRV90MlgyOGgtcTFlTnpuWFpvZzBfVDh4UnBBQV9tSmJROG1LLUF1TUhGeGcyMHQ0RVFvbDJ3S2RwMllwdVVLR21jUkQ4QWpXZnlxcnlxbEpKV1NVQTNNbnBaVkR0R1l3OEJ1bVVDOEx3Y2hZcm00Vlk5YVRnQktvMUszUk85c0t4ZHZoUDNRbm11MDAwQWNRZDZ5N3ZqUlpnSk1RUEc5SnBvVzVLcldjWGF1NVhYWnlIZzVvNEdPU0JfZXlhd1FYOWJHM0JNRWZlaThVMTFjRmIxeV9aWE9NM0VzMHFSdi1VNnlJdjljZG9jUzM1RQ?oc=5&hl=en-US&gl=US&ceid=US:en,Business Wire
2025-01-31,Is Northern Oil and Gas Inc. (NOG) the Best High Growth Low PE Stock to Buy? - Yahoo Finance,Is Northern Oil and Gas Inc. (NOG) the Best High Growth Low PE Stock to Buy?  Yahoo Finance,https://news.google.com/rss/articles/CBMiekFVX3lxTE1XTkE5N1otZ2U0akxpVEdvaDhZT3dRR004eWFPSjhHZGVRX1JMOTJNQmd6ZlJ3VE95bkpjeE54SkN4MGhyVndhMVBOV2xTQ0ZkYm5PVTE3WWZ2a05wV0UycVhOYUJFZHNoT1IyUFRZTDdhWHAya3pLUGdn?oc=5&hl=en-US&gl=US&ceid=US:en,Yahoo Finance
2025-02-05,4 Energy Stocks Rewarding Investors With Dividend Hikes - Yahoo Finance,4 Energy Stocks Rewarding Investors With Dividend Hikes  Yahoo Finance,https://news.google.com/rss/articles/CBMiiAFBVV95cUxOLW83b1JXU2FBaV9kTVZGNWhiaU5SQzdDZjJHVlZGWG45Z0NKLUtDRTdHOEdNNlZSQlJYeV83djJNTkM4czFMNnQ1al9FNzd2YzBXWW5GMVBpT0JTQXdXUWRQZUI3Yl9SWlNlbnNPOTBEQnN2THhvZjZEXzJIVmJaWG1KZ040cUVm?oc=5&hl=en-US&gl=US&ceid=US:en,Yahoo Finance
2025-02-12,"Why Northern Oil and Gas, Inc. (NOG) is Declining - Yahoo Finance","Why Northern Oil and Gas, Inc. (NOG) is Declining  Yahoo Finance",https://news.google.com/rss/articles/CBMiekFVX3lxTE9fc0I1YTNDcmd2YnpvRWxDNFU0emhuaXBHN0tGcWRiY19SM3dmanBXLTR4d0N3SWNVdGpYalpubTVmQkQzdEhmQXJZV2dKNktScUgzTzZJQkZlODh6ZWZYSDdKNHpQWV9XaS12ZXFZcTcxVW01el9HVG1B?oc=5&hl=en-US&gl=US&ceid=US:en,Yahoo Finance
2025-02-12,NOG Provides Fourth Quarter 2024 Operational Update; Provides Initial 2025 Capital and Production Guidance; Announces Signing of $40 Million Bolt-On Acquisition in First Quarter - Business Wire,NOG Provides Fourth Quarter 2024 Operational Update; Provides Initial 2025 Capital and Production Guidance; Announces Signing of $40 Million Bolt-On Acquisition in First Quarter  Business Wire,https://news.google.com/rss/articles/CBMi0AJBVV95cUxORVBfdUhydjRlUFNjOGxpUll6Y1REeHNjTlpSdHQyOFdKYjFtMVYtM3VPb0xUWW5KRVZYOFY0eWgwOTNuUFlPTlB1RWZDelo5dFktd2piTVZiZEV1aDUzb0o1WWRvNkFaTXdsMkRoejNKN0l2REZPN2NNdGZTblAwUmZfUzZDa3hXZkw5RU5Gd00zUm53UGhDSVh2eXJ1VEE1cGRyTUpUMFZYSkhpX1MzSWM0LUxmczJYVy1yeVlBbUNiaE1ONmJuQTVFamZfTElIS0Jic2d3UFFoN3RGdDJpNkRycndNRHVWNHF5TTVNalFCREhnYWlFRnVsQVluVHk5OGhkYVdoMGRJbHRONnBMRG5KdXMwdXFQbjRlUkpyS214eC0tcHQ3VFp2ZEVTZ05QUnpleTJWYXQ2bTFNLVJEQnVkcHpuVTJ1S1puS3ZrY1o?oc=5&hl=en-US&gl=US&ceid=US:en,Business Wire
2025-02-13,"NOG Spends $67MM on Midland Bolt-On, Ground Game M&A - Hart Energy","NOG Spends $67MM on Midland Bolt-On, Ground Game M&A  Hart Energy",https://news.google.com/rss/articles/CBMikgFBVV95cUxOYmdObUR1U19vWGhTMUFkdEpJcmVwalA0QmsweENybVdsdXloWndfQzVUZlJQajhQOGJVaVA1WmM0YXJqd0F5TlRTZjNPdzlJNzNSdDJLUDRzajlHaEJPYm5ucEZJTUdzMUVCc2EyTW90NVNmZk5EX2kxMmMzUmpGdnI0cHFxcDdOREJKT2dMU1NPZw?oc=5&hl=en-US&gl=US&ceid=US:en,Hart Energy
2025-02-18,Will These 4 Energy Stocks Surpass Q4 Earnings Forecasts? - Zacks Investment Research,Will These 4 Energy Stocks Surpass Q4 Earnings Forecasts?  Zacks Investment Research,https://news.google.com/rss/articles/CBMingFBVV95cUxPM2p5YUVpLVI4dlBQcDhob3lkblZjZGtGRGR1LXBUZkV6ZndJVFpYdC01Z3FWdURCU0FwQlU4WkJ4b1dOLW5wcWZSTWxZUWlaVFlHLS0zYmIwRl9ocTZUSERsWDA3TmdFNEpSOVhBSENSSEZYUjlyLWljaVpxTjdzdmJHXzIzYlhVcmNqZld4NWJlQ2I3Tm40Sm9iTlItdw?oc=5&hl=en-US&gl=US&ceid=US:en,Zacks Investment Research
2025-02-18,NYK to Invest in Northern Offshore Group AB to Strengthen Offshore Wind Collaboration - 日本郵船株式会社,NYK to Invest in Northern Offshore Group AB to Strengthen Offshore Wind Collaboration  日本郵船株式会社,https://news.google.com/rss/articles/CBMiZEFVX3lxTE1IYmtGeTBjNkZRbHRSTnh3VDZuZDQyMmZXVEQtSU8yMVVLRUhIOGs0NW9MNWZQdGt5ZElqT016WlBmbXhSSUNtRDhvaVc4OEhSMlFJSHE0eHVDcjdQVDhKdHpaM1Y?oc=5&hl=en-US&gl=US&ceid=US:en,日本郵船株式会社
2025-02-19,NOG Announces Fourth Quarter and Full Year 2024 Results; Provides Detailed 2025 Guidance - Business Wire,NOG Announces Fourth Quarter and Full Year 2024 Results; Provides Detailed 2025 Guidance  Business Wire,https://news.google.com/rss/articles/CBMi3AFBVV95cUxPZ1hfSEpOSzA3VDUzUTJCSEhfcDZEU3dyRV9aNE9ZTEtJU1Y5S29HUzJDWnJVcFp4akRKR3ZUN3NPOXpnblhyN1JBM3BxNlAwMnJJMnRVMjFtOG8yakJkYVcxU0V5eXcwaWR5WnduLXJPTUpDVmhRakprQ2tPTXhhd2N6MlhCckVKZTh3MkZITWhYaW9Td1d1SERpc3VELUxmX3NzOTFDMTAxWVFoWWpYRTdEVUdkMDdfYW8tUjdGQW9YZDFDb2d1bU9nc3NpNUQ4OTNIOEhVYmhDZGhl?oc=5&hl=en-US&gl=US&ceid=US:en,Business Wire
2025-02-19,Here's Why Northern Oil and Gas (NYSE:NOG) Has A Meaningful Debt Burden - simplywall.st,Here's Why Northern Oil and Gas (NYSE:NOG) Has A Meaningful Debt Burden  simplywall.st,https://news.google.com/rss/articles/CBMizwFBVV95cUxQZ29DRXJaZEtjOVpSODR4VUtKeFREWkhYM2RBSnZaakZnQlp1VjdCSUFhZmM0U21objdaandtaEdCOVNxMnFOeUc4UlFPekZndVJkVzVvWDZ4QkpJc2wzNFBMNVAya0xZRnJ2cV9GNTZ3Sl9QZGllMFczQ1otNEhCLWx1bkN1WmJ5YkJtRVpReTJQb0Z6ZmVkcGpkRWIzRWdFNEpXSGcweTBVUEZaN3hCTjFzaFVRajZrZXhGN0E1bXB2ekhIcnJjaVFBLWE3YlXSAdQBQVVfeXFMTlRHNmNXcTNJeHZJOFhNQVZpdUJ6M0FwWlF0dXRRc0NwWjNXVUVCQi1RYjlaSXY1b29KR2hwSndfdzFya3dxcW4yYU1yN3JIUUc0SDFYaTJtNHJYcDh4dkdzbzJRVm9OZFFEMXQyalhIR0g5SVloYVNvRDV0OEFzWTRwZndpTnFCVHJtSVVWM3VYRE4zWnhHdXY4aXdnbTY1bmlrQVRKMHppLUNyTXFDM2dVNUlqWUJRelZ5cHM0R3lhWlBfZEI0clBOSnFLcVhGN1dIUUs?oc=5&hl=en-US&gl=US&ceid=US:en,simplywall.st
2025-02-19,Northern Oil and Gas (NOG) Q4 Earnings and Revenues Miss Estimates - Yahoo Finance,Northern Oil and Gas (NOG) Q4 Earnings and Revenues Miss Estimates  Yahoo Finance,https://news.google.com/rss/articles/CBMieEFVX3lxTE41X1FhWTNuV1NNUHk1WXJRODZNbDRlMG1aOWRDMC1CeE9BalVyWlpXazAyT3Fjc3BrYmk4VjdTZkl3bm5UbEhvSk14TW42ejVTM2hhUmVQbXVyZXBvYW8zMWZtaGtnWVFTVV9SSVpRbk8zaDZrdHd2Sg?oc=5&hl=en-US&gl=US&ceid=US:en,Yahoo Finance
2025-02-21,Trump order opening Arctic Alaska waters to oil leasing draws legal challenge - Alaska Beacon,Trump order opening Arctic Alaska waters to oil leasing draws legal challenge  Alaska Beacon,https://news.google.com/rss/articles/CBMitAFBVV95cUxNc1JmbW5PWTNkTC0ySzJ1RTI2Mm9LQ3FkSjc4VVVGQVV4dG1JTjNBSFBGbHBnc3VCX0FnNjlUNUlnSGotV2Fha084b0wyVjNoc2I5UHFFd0k5REN0TE4xV2F3QlE0UFNGcVVONFljZk9xcDZmYzY4RmhIYkhYUUNEbXFNTmdKRV9PdDBmbEF1Q2dxUnlhekpzdFF2RUZYOGhhdWtoRzk4ZHNqLUhrenBwSk5nRVA?oc=5&hl=en-US&gl=US&ceid=US:en,Alaska Beacon
2025-02-25,"NOG Posts Lower Earnings, Revenue in Fourth Quarter - Rigzone","NOG Posts Lower Earnings, Revenue in Fourth Quarter  Rigzone",https://news.google.com/rss/articles/CBMiqwFBVV95cUxNR2xCeldjOWhrT2JSVVFBa2ZEVC0tRHFTRlh5WDNOQjNhUzVEaDIxNTF3YVo0czZzWEZDTDZYUzh5MGxqQUZ1MGMtZDB6MGZKN2JqNE4yWE9IOFZQSVpSXy1CTjE3akh1aEhIMUVQT0I3cU91OV9XUEpDb3FsUC13Qlh5MHdVTVBHNVItcEZIX1RiUjFqMlQ0TTlSRmRIc1hTZ09ZTXlWYWlTTmc?oc=5&hl=en-US&gl=US&ceid=US:en,Rigzone
2025-02-25,"Northern Oil and Gas, Inc. (NOG) the High Growth Oil Stock to Buy? - MSN","Northern Oil and Gas, Inc. (NOG) the High Growth Oil Stock to Buy?  MSN",https://news.google.com/rss/articles/CBMi1gFBVV95cUxNb01qc1Q4R2k4TEp4eGZaMlFXdXJ4TEZVWWZ4cVBZb0ZWRVZuRVMwRkFZSEJPVm5nQUZFTF9VdVVMZVRWOERnMjF6WEIzTmV1dVNCV3RkRnZ5eF9fUmNKTmp1U0NIcFo4VTRBbEJZekZEZ1FBVnh6Ukg2bGlRWjBVTllQcUVLejhSb3A3OXBFSkhKOHI1eDlZXzZmSktJcVMwUGR5NENqUkY0cmJ2dzZfdFVVZmlKRUFSSDROY0hRSk1uWWpBWEgxc3pDMDNhMHg5eGtoY3NR?oc=5&hl=en-US&gl=US&ceid=US:en,MSN
2025-03-01,"Northern Oil and Gas, Inc. (NOG) the High Growth Oil Stock to Buy? - Yahoo Finance","Northern Oil and Gas, Inc. (NOG) the High Growth Oil Stock to Buy?  Yahoo Finance",https://news.google.com/rss/articles/CBMiekFVX3lxTE8yQVhkblcxb21sRS01dHJVaWtoU0VzRzhrX0lQM2luQUJpVGJpSkN0a2NhcHZOMWJfTUljWXhkOElVRTR1a0ZwWW9vMDJOZ1NRdFN4c2dpUzUxbzhfVllCWGVQYngyRmxTUTQzdnBwR05ITzBNSTJNdlRn?oc=5&hl=en-US&gl=US&ceid=US:en,Yahoo Finance
2025-03-01,"Northern Oil and Gas, Inc. (NOG) the High Growth Oil Stock to Buy? - Insider Monkey","Northern Oil and Gas, Inc. (NOG) the High Growth Oil Stock to Buy?  Insider Monkey",https://news.google.com/rss/articles/CBMiqAFBVV95cUxPbTVFZWtCcFlXYTI3Wmg1N1J5WlRKdEpVUGFLMUttZV9Xc2Q2SHRRcEhmUXhQOXltdU9LRkVPZ28ycHU1QWJzMnYzc2QwS0d5YWhzNXBpcXFYTVpKaE1mMXJ6ZFFiNTNEYkNJdWtFd1lNdFN5emQ0ZXcySUpTanFrd3EtSGppMU9ZQkFWLWJWdkI5b2x0SjBiNVNJT2xSRG9kMC1kTi1xemvSAbABQVVfeXFMUE42SFBiZ2laWnBoWlpCUTdPZHBvcnZ6M3B3Unk1bGdYX2JBMTdvaUNTRjBkcmFROHBhbDdSMmswY3JaU1Bwc1VBOFlHRU9aNWtDTW5udVdMQVVyNTFKM0FlR3lrejUzdm5mS0RZVTljRW1LcFpoWEN0N1kxcmQ5VW90dGl4N0RxaEo2R3RJRHVhWmhQblFBeWNBNmtjWkZxLXl1QzFXVGJ4cGdScHJvZWc?oc=5&hl=en-US&gl=US&ceid=US:en,Insider Monkey
2025-03-03,"NOG CEO Nick O’Grady to Present at the Raymond James 46th Annual Institutional Investors Conference on March 4, 2025 - Business Wire","NOG CEO Nick O’Grady to Present at the Raymond James 46th Annual Institutional Investors Conference on March 4, 2025  Business Wire",https://news.google.com/rss/articles/CBMigAJBVV95cUxONXM3bVNiMnA5eGNndEVtblFqWnJ2QTh4alVncFVUOGMyemlWVUdqZHlGOWgzVGIwWm4xcHlIY2V5UDJoeUNtVXFJbGpjNUN5SmJub1Q3WFo4cFVaVmZLalkzdmVGaUk2bWxTZDBEeVk0MmJ2VGtpV3V3UHdvY1d0RmRzUGxHa3FuNFlvYnVWNWdRZ3I5aDh0QzRzLU9aWGFoUDBBZTU1VFgyYUVpdjlrdktOcUlnTUU4XzZMdndRR2JuYWdMOVlzXzRtQlJCTHQweDJjWTY2ZmNMdlUtYko2QWZ2SlRjcG1xUDkxMDhMYlRkbENabW5xVlp2dVBZdEh1?oc=5&hl=en-US&gl=US&ceid=US:en,Business Wire
2025-03-04,"Northern Oil and Gas, Inc. (NOG): Among the Dividend Stocks That Are Underperforming in 2025 - Yahoo Finance","Northern Oil and Gas, Inc. (NOG): Among the Dividend Stocks That Are Underperforming in 2025  Yahoo Finance",https://news.google.com/rss/articles/CBMiekFVX3lxTE91Y3lJRXJGdllYZ2RydzducW45VGVfUWZTbGVHRUNxUmVBLW5uMV9NSm5kUmtKbDZiSS1RcV9aWm1MaFJVZkYzRmhXdkx3cENOLV9razRJcjdDb2gxRjR4Tmk5NTVMOTVQNU9wVjY3UGRoYjNYLWgySXZn?oc=5&hl=en-US&gl=US&ceid=US:en,Yahoo Finance
2025-03-06,Northern Oil & Gas at Conference: Strategic Growth and Innovation - Investing.com,Northern Oil & Gas at Conference: Strategic Growth and Innovation  Investing.com,https://news.google.com/rss/articles/CBMiuwFBVV95cUxQb1ZrZXlqMkVmQWNvUC1FN2RFbEl4RjBkb0NoTzI5MDhjUXA2cUktYU5ROVozbTJzWFVHYk5mQ2V2dVdXRGxsQVl3NVZpdmNoZDlRdVExczdoSm5iNUtpMUY1MGxVVlZjajJJYTNXTklDb1RELUpKdHlQWDJFTDJKT083RncxRnRSbWk1dE9IWlV5eDRMRlhvaTRPZi11M2tnaXRkMGp0S3ZCSWVoTFlvMW9LXzVsWndhNE1J?oc=5&hl=en-US&gl=US&ceid=US:en,Investing.com
2025-03-06,Northern Oil and Gas (NOG) Q4 Earnings: How Key Metrics Compare to Wall Street Estimates - Yahoo Finance,Northern Oil and Gas (NOG) Q4 Earnings: How Key Metrics Compare to Wall Street Estimates  Yahoo Finance,https://news.google.com/rss/articles/CBMieEFVX3lxTE5SZ3Vtd0RZaXZOWlZ1QkNLY1NwU2tvQ1k4R0pHT2VlRDhCMkZId25LMHdSQ0UtWXNjUG1kWTUwYlFocm5LT0M3dE81dTVVc1J6NXR6YzlHTVVXcVZqVkoySDdEVXl3Vi1qLW91a3NTQWpSWVNTRl9pWA?oc=5&hl=en-US&gl=US&ceid=US:en,Yahoo Finance
2025-03-06,Disputes between Baghdad and IOCs keep northern oil exports offline - Iraq Oil Report,Disputes between Baghdad and IOCs keep northern oil exports offline  Iraq Oil Report,https://news.google.com/rss/articles/CBMirgFBVV95cUxNNFNfeHdSNnF4cDlhUGNBcXMzMXpLeTNRczRNVmpOVlowcHEzLWNqMHNQZU85T0l2Q2ZYRDQ2cEdOY0haZFdybm4yX25qVXJxdk9EYTRrc1JSaUdmSGJSMVVvcU50VmVSdk9jemVHNlN6ZF8yaEhFa2VmMThSWEdZMTI1TzEyTlZQWU44bjhJcndBWF91N3U3QXFHMWl5TmZBeGxjeEhiT0ZWaWpCSXc?oc=5&hl=en-US&gl=US&ceid=US:en,Iraq Oil Report
2025-03-06,Northern Oil and Gas (NOG) Q4 Earnings: How Key Metrics Compare to Wall Street Estimates - Nasdaq,Northern Oil and Gas (NOG) Q4 Earnings: How Key Metrics Compare to Wall Street Estimates  Nasdaq,https://news.google.com/rss/articles/CBMitAFBVV95cUxOQzRHQVFUM1RqZDQ2Vi1keXlTeVhoTDFrSkJkUGtWNVpzOFV0NlNSY09ieHR1MWtZcURXNEZrNUVlTDEzNlcyQVVFODdHU2ZQaXNhR3lOMWpYZGRFV21PazhDMW83V1pTYk9laHNYUHVVUlhxUW1wdlJ5eVFHMTRTV0pFMml5aHNUVFVRU0dJWi1aMnJhZGRqTEpTVDVncGxqY1pIcUk3Y2RyZUJ3ck9HT21nNU8?oc=5&hl=en-US&gl=US&ceid=US:en,Nasdaq
2025-03-07,Northern Oil and Gas: Projected To Generate Over $300 Million In 2025 Free Cash Flow - Seeking Alpha,Northern Oil and Gas: Projected To Generate Over $300 Million In 2025 Free Cash Flow  Seeking Alpha,https://news.google.com/rss/articles/CBMiuwFBVV95cUxQZ2dQcl8ybVNXX3l3dWJWYXRiTTJ5Q1E0eTA4QnhnSVZUaU9MaGp6N0Q4dW1wYktNMUxzbFlxWlY2X0lrcTR0MHRDdDFBWEZVeEpBbXhlS3BLQmt4Vlg2MG5GRjRsTDhaTVN1RHozOUVOVUtXeHF0bVliZDh4RTBXdlB4RDBjbzA5WTgzYVJsVmxRUUtJa2Y0N2RDY0VTTmh1a0Q1ZThDZXUzUmx0OU5ZU3NJQ0xtbG9LWTJR?oc=5&hl=en-US&gl=US&ceid=US:en,Seeking Alpha
2025-03-07,"Earnings Working Against Northern Oil and Gas, Inc.'s (NYSE:NOG) Share Price Following 27% Dive - simplywall.st","Earnings Working Against Northern Oil and Gas, Inc.'s (NYSE:NOG) Share Price Following 27% Dive  simplywall.st",https://news.google.com/rss/articles/CBMizwFBVV95cUxNYXJJaGhnZXRsNDJTN0dTaWlrczlFODJheXNlUnZkUENaNmMtNGxnUEpHOWxpTGdXTzJWWjBhR3Bmdnd0VjRUSWowLW9Vd2ZpOGV5em1xS204N005cVZvdDdhbWxkWHY2akp3UkxDaFZsZ0dJU0ZaQW0yUFhCUklIcFFBM0RWR0pmeVhOU0VHVHNPaVRXZnB6cGtsSjc0SkQwLXVlUnRXS1V0TnlNVlQ3U0VsS1VGLVFOTjhlX2plRTlkXzlLUFRxVGNUb202ZUXSAdQBQVVfeXFMTTFVbDh2aWo3NEZxS29udllRMFBJUi1tRzRIZnprSEVJa2VlSzNITW9QNFVNMTFtYjdYWmFVaFNWb2NEYkRZM1hPZWRCVVBFZlFEQzAtd0U3MkJod0RKdkJIZFkybEVDa3pWamNfYU5nY1hoaG13ZEQ3RVlMVHdsVGxoYXo3bmprdS1XSURxV05JNUQzcGQ1dFNMN09OUXZ2ajJ4VHdjdmRCRmZheWo0ajlqR3ByTzduYTVyNUdfbEZwaVZrQlBabWhwMjZFQ21ILW5DbDA?oc=5&hl=en-US&gl=US&ceid=US:en,simplywall.st
2025-03-11,NOG Board Approves Increase in Share Buyback Authorization; Adds $100 Million to Existing Program - Yahoo Finance,NOG Board Approves Increase in Share Buyback Authorization; Adds $100 Million to Existing Program  Yahoo Finance,https://news.google.com/rss/articles/CBMihgFBVV95cUxNR3FIbGdJdnliSERxMmFwSC1BTGZXNDc2a3k5cUgtYWUxT1FfcmhXejdWZXBaejdraUNxbUhaWUdWNVJSOEktQlJzdFl6b0ROUnY3cjRNTUZ5Q2V3Q2VYaVM4UzVQcHF6ek9XaWFKUW9OOHZhOS1yWGtXNTZMb0pmdWJaeGpOdw?oc=5&hl=en-US&gl=US&ceid=US:en,Yahoo Finance
2025-03-11,NOG Board Approves Increase in Share Buyback Authorization; Adds $100 Million to Existing Program - Business Wire,NOG Board Approves Increase in Share Buyback Authorization; Adds $100 Million to Existing Program  Business Wire,https://news.google.com/rss/articles/CBMi6wFBVV95cUxPN01XWE02cnFNTzRMUnJIUDhJMW5yTmtqeHRmRE13N01vNFZkZExaZjA1enpvYVBHZUtaQjk3N3duMUtGMWFQZ08xSFFOblhlN3V4dWhJN1BFbmJYeDdpYVBLUXlIRXBadlN5SGtIMk1IZzVCQThtMjhIdGQxTUlfaGYwSFhmS3pwY3k0N3pOMXBmaXJnVl82T3BsSEdCZWlhOGpOaG9fQkl6bkJzVEpWQ3ZGc0dxSDFsYmY0ck9aTEdpaFYycGpwQ2RYYkQ1ZEVRbWktRHpjb2Fqc3NhcFBfUWdoM2dPT0ZRQWVZ?oc=5&hl=en-US&gl=US&ceid=US:en,Business Wire
2025-03-13,NOG Raises Buyback Plan by $100 Million - Rigzone,NOG Raises Buyback Plan by $100 Million  Rigzone,https://news.google.com/rss/articles/CBMimwFBVV95cUxOZ2tXMzlDSTRuSm1tdlVnUzBPRkdBdUZsUWdSSUNvRDZHenlJLVlxam52Ym5UQ3NVMV9QR1J0SjBnbF9IQkVEMzBLeHIyRWQySUhZcENjZ1MtY2VJY0pYWnNIbWVaSFRWdUJMNTBEaVRLQ1pPc3JxbEtGTzRtSnB1ZGlaY2d3cUhoRlpSR3Z1ZVNhOXNWRFU2ZGZxaw?oc=5&hl=en-US&gl=US&ceid=US:en,Rigzone
2025-03-31,Investors in Northern Oil and Gas (NYSE:NOG) have seen fantastic returns of 318% over the past five years - simplywall.st,Investors in Northern Oil and Gas (NYSE:NOG) have seen fantastic returns of 318% over the past five years  simplywall.st,https://news.google.com/rss/articles/CBMizwFBVV95cUxNVUlYMUxNU3c2YnczMzlfOGpqckhaZktPSjF5SGdiOFlFRlRpWXlDRDBNMXJERnZUd245ajczLS1wTkpxRlVvZ2FTRmFfVTBrY2VLTDlZaE9mQUtJOGRqS0pacTdyMGJ0amRhdVdkQldnb2l1Wml1NHhuSWNyQWg3M3Q3NmU0cXpRekE3YTlIMFNBNHJGbVJJTkRKdWpLX3lXU3FSa3RvdFA1ZVdhU2R5dmdlT1IxUUg5Ml8xek1HNC1aYnkzcjBXZEx1dWVWX1nSAdQBQVVfeXFMTUxwM3dTSWVTemp1RjA2ZVlBd1lCRFE1akFYOExjOUowWXVPN3J6MlJ3U285bDdPWUFrckE3ZFRuMHZ4S3owTWFMTWtBSWhUUzlmVWFNZXJxQjFoeHowS0JKU2ZSMGo1UEdueVR5dWExTkYwc3EtZGdYVVp6NzQxdlBHVTlReS1uVnZVLWFtY2kxd1EzQ3hfUW5JNFlTemJGbnpSbnRoTmxXMkduQUt3RzBxNFVIV2MwOVBQZHNuMXNLenZJUFpQdXJvanh2SFRRNmgtVGI?oc=5&hl=en-US&gl=US&ceid=US:en,simplywall.st
2025-04-01,Oil and Gas Investor Magazine - April 2025 - Hart Energy,Oil and Gas Investor Magazine - April 2025  Hart Energy,https://news.google.com/rss/articles/CBMifkFVX3lxTE5uR3Nyb09PeTVNaGh3eGVTdmJrX3pUR19meERvdGowbHQ1dDFGekY1aGt6ZDJ1Z2pOZy0zRzg1S0Z3QjAyMmVaM2hMRGVDZHEteV9GUVhqd2dMNlNSSGVqNVFJcHZHNEdVaDdFYnJQUFpQVElkSmFqZURFUjVtQQ?oc=5&hl=en-US&gl=US&ceid=US:en,Hart Energy
2025-04-03,NOG Stock Crowded With Sellers - Nasdaq,NOG Stock Crowded With Sellers  Nasdaq,https://news.google.com/rss/articles/CBMia0FVX3lxTE5UMHRNSE45U3luSWpJaWxTNm9aeEluTDR2T05aUTg2RnpMaTl3ZlJTS1BkU0phbER3a2FBVUNWXzRhQzZRc3gyc0hVMjhkX2xlOURGN0JIWXlSVnZudU9fbUtYVkhOY005dU5V?oc=5&hl=en-US&gl=US&ceid=US:en,Nasdaq
2025-04-07,"Residents in Northern Colorado neighborhood asked to leave homes after oil and gas ""containment loss"" incident - CBS News","Residents in Northern Colorado neighborhood asked to leave homes after oil and gas ""containment loss"" incident  CBS News",https://news.google.com/rss/articles/CBMirAFBVV95cUxNZ2dYYUdubWJjZjJ6YTZXYmRBdVhwNVpNZjN6M1RSekRqNUg0MjQ2WldHQ3c5NmtPNVBBdVh3QkZadkNYZzZFNldoWGZRVkNJeWxrQml4RVBscXFEd1NSUjZuNmo3anFlbzJveDZTQjZoSjRWVXAwU1RlR3dJRHFQdFRvMm4xYVdxQnNKUEhKNjVQTjN2ZWktLTJDVmJBSFowd01qaXdZVy1MT0ty0gGyAUFVX3lxTE9OOElrMy1SUGM1UHhKT2xpU1NBZnU4emJIVE5KLVktUVJrbFNXbGg2SnNFdWFISzU2R1JBc1Q5NC1IaV85VTI2akp2bENsblRhbDU1Qy1HYkJwRXdVMjlqZHd1eURwSFRXaTY4aVJKR1M2X0prMGYtdEFXSjIzTVV5ZENVZ0lzNC12YmRSUmVodU9VdURYQS1XLWJWdVVRS3dHRWF2SVU3MEpoT3h4eTNVY3c?oc=5&hl=en-US&gl=US&ceid=US:en,CBS News
2025-04-09,"Community meeting planned after oil and gas ""containment loss"" incident in Northern Colorado - CBS News","Community meeting planned after oil and gas ""containment loss"" incident in Northern Colorado  CBS News",https://news.google.com/rss/articles/CBMitwFBVV95cUxOMGtqU1JVVzh2V3lBaUItYnhzMXlQRk5oU1E4REdHQy0zOUljZWxoQkFvUnlZRngwUDdJZWhnUFN1NkZaVE1BTENiOTNLd212OHVyRzQ1TVBTSDZLdVRIMjVUVFJha2NXUU4yTXlaR2J1QUZyR25Yc2JoUHlXSVdqVUNGNVpCS1hNUDNOYUpUZGxGdVlFaGxWZjVsWm4xUjNYRUo0TkJNdW5BRThFcEgzdmFOUFowZEXSAbwBQVVfeXFMUHNyeGwyREFpSkRIaFdQOHZxWm9tZFFpRHBYRzJ4d1VtMVpvNXBXVW1ScDZ1Qm1TdFRxX1Y3WGpKQWRzM0NsTW1pcWV3Z1l5VHhFaEtHSGEtX1pTeFZzR1QwNDV1bWhzT0NyTkI4ei1NUElrbUdPOUpMaUJzTTJiZUZaZ0stUWxxaVk1MndVYVliTzFXUmJudDYwaFh3Q0NzdThvY0JXTW1RRXhDTlU1cjB5OTVpUkxrNmlVRVk?oc=5&hl=en-US&gl=US&ceid=US:en,CBS News
